id_recipe,name_recipe,portions,calories,protein,fat,carbo,text_recipe,vegeterian
353,Сосиски в сдобном тесте,12,321,11,16.0,34.0,"В 100 мл теплого молока добавить 1 чайную ложку сахара и дрожжи, оставить на 10 минут. Дрожжи должны подойти — появится пышная пена. Яйцо смешать с оставшимся сахаром и солью. Добавить оставшееся теплое молоко, дрожжи и сливочное масло, размягченное при комнатной температуре, перемешать. Добавить муку и замесить тесто. Тесто разделить на 12 частей, скатать колобки. Из каждого колобка скатать жгут длиной приблизительно в два раза больше, чем сосиска. При помощи скалки придать тесту плоскую форму. Каждую сосиску обернуть в тесто по спирали. Выложить на пергаментную бумагу, смазанную растительным маслом. Желток смешать с 1 чайной ложкой воды и смазать им сосиски. Дать сосискам постоять минут 15, чтобы тесто немного поднялось. Выпекать до золотистого цвета при температуре 180 градусов (приблизительно 25–30 минут).",False
354,Запеканка по-итальянски,4,903,68,51.0,43.0,"Очистить и сварить картошку. Нарезать грибы и куриное филе, а затем пожарить. Для соуса смешать сливки или молоко с приправами, поставить на огонь, дать нагреться. Сыр натереть на крупной терке. Зелень мелко порубить. Разогреть духовку до 180 градусов. Противень смазать маслом, выложить на него картошку, затем — курицу и грибы, залить соусом и посыпать сверху сыром. Поставить запеканку в духовку на 15–20 минут, до готовности, пока сыр не запечется. В конце приготовления можно украсить зеленью укропа и петрушки.",False
355,Яблочный штрудель с изюмом и корицей,4,953,17,45.0,117.0,"Для начинки яблоки вымыть, разрезать на четвертинки, удалить сердцевину и порезать тонкими дольками. В сковороде распустить масло, положить яблоки, сахар, влить бренди и тушить на среднем огне до испарения всей жидкости. Смешать яблоки с ошпаренным изюмом, молотым миндалём и корицей. Выложить начинку на тесто Тесто слегка раскатать в одном направлении в прямоугольную форму. Присыпать молотыми сухарями, оставляя тесто не присыпанным по краям (1 см). Выложить подготовленную начинку и аккуратно свернуть в рулет, края защипать. Выложить штрудель на противень застеленный пекарской бумагой, смазать растопленным сливочным маслом или водой и поставить в разогретую до 200–210 градусов духовку. Выпекать 30–40 минут. Готовый штрудель еще раз смазать сливочным маслом и посыпать сахарной пудрой.",False
356,Минестроне с дайконом и укропом,6,161,6,7.0,21.0,"Очистить морковь, дайкон, корень сельдерея, картофель, красный лук, а также лук-шалот. Срезать верхние части соцветий цветной капусты, остальное выбросить. С цукини срезать с четырех сторон бока толщиной миллиметров семь, внутренности не понадобятся. Очистить сладкий перец и срезать его сердцевину: в дело пойдет практически одна кожица. Нарезать дайкон, морковь, корень сельдерея, картофель, красный лук, лук-шалот, цукини и перец небольшими кубиками. Размер всех кубиков должен быть примерно одинаков, чтобы суп был красивым. Верхушки спаржи ­нарезать по косой овалами толщиной в полсантиметра, зеленый лук — колечками. Помидоры черри разрезать на четвертинки. Разогреть в большой кастрюле столовую ложку оливкового масла, бросить в нее красный лук и лук-шалот и обжаривать, пока они не станут мягкими и прозрачными. Добавить морковь, лавровые листья, картофель и стебли сельдерея. Чуть посолить и слегка обжарить, не спеша помешивая. Положить корень сельдерея. Влить воды, чтобы она только покрывала овощи. Вместо воды можно — и даже предпочтительнее — взять овощной бульон, например, его простейшую версию: из моркови, стеблей сельдерея, репчатого лука и лаврового листа. Варить три минуты, кинуть тимьян, положить дайкон и добавить воды, чтобы она снова покрыла овощи. Тем же временем в отдельной кастрюле вскипятить воды и бросить в нее на минуту красный и желтый перец. Кастрюля должна быть отдельной, чтобы перец не передал супу запах. И еще он не окрасит бульон, а будет представлен только цветными кубиками, что от него и требуется. Откинуть перец на сито, переправить в суп. Долить воды. В отдельной же кастрюле бланшировать цветную капусту. Через две минуты, после того как в суп будет брошен перец, добавить откинутую на сито цветную капусту, цукини и спаржу. Вынуть тимьян. И снова подлить воды, чтобы покрыть ею овощи. После этого варить суп, помешивая, десять минут. Добавить зеленый лук и помидоры черри. Через полминуты кинуть целиком два зубчика чеснока для аромата, посолить по вкусу, а после этого — в самом конце — влить столовую ложку оливкового масла. Еще полминуты — и можно снимать кастрюлю с плиты. Из готового супа вынуть лавровый лист и чеснок, чтобы никому не мешали. Разлить суп по тарелкам. Сверху украсить ­листиками свежего базилика, посыпать мелко нарезанным укропом — и звать всех к столу.",False
357,Баранья нога в мятной панировке,4,1087,61,86.0,16.0,"В блендере, используя пульсовый режим, превратить смесь оливкового масла, мяты, перца, бальзамического уксуса и белого винного, сахара, соли и тимьяна в грубую кашу, где мята еще сохраняет какие-то остатки своих форм. Этой кашей тщательно обмазать баранью ногу, с которой предварительно должен быть удален практически весь жир. Проделав все эти операции, нужно оставить ногу в мятном маринаде на два-три часа, завернув в фольгу и поставив в холодильник. По истечении этих часов извлечь ногу из холодильника, водрузить ее на противень. И поставить противень в духовку, разогретую до 220 градусов. Подержать ногу при этой температуре пятнадцать минут. Потом снизить жар до 180 градусов и держать ногу в такой температурной ситуации еще сорок минут. После чего вернуть жар опять на уровень 220 градусов, дать ноге провести в духовке еще десять минут. Вынуть из духовки, нарезать тонкими ломтиками и подавать с обжаренными на гриле овощами.",False
358,Долма,6,724,39,49.0,27.0,"Подготовить овощи, мясо и зелень: лук разрезать на четыре части, помидоры очистить от кожицы, предварительно ошпарив их кипятком, сладкий перец очистить от семян, мясо — от пленок. Листья винограда ­залить кипятком и оставить на десять минут. Мясо, овощи, зелень и сливочное масло пропустить через мясорубку. Фарш тщательно перемешать, посолить, поперчить, щедро приправить сушеным ­базиликом, добавить щепотку паприки. Рис всыпать сырым и снова перемешать. Аккуратно, чтобы не повредить, разделить листья, жесткие хвостики отрезать. Листья выложить на поверхность глянцевой стороной вниз, прожилками вверх. Выбрать листья одинакового размера — большие отложить, они еще пригодятся. На каждый лист положить комочек фарша величиной с грецкий орех. Плотно завернуть, но не слишком туго, чтобы разварившийся рис не про­рвал листья. На дно кастрюли выложить отложенные листья. Уложить долму плотными рядами, но не утрамбовывать. Залить водой так, чтобы она не покрывала верхний ряд (вместо воды можно использовать бульон). Прижать долму тарелкой, чтобы рис в ней проварился равномерно. Поставить на огонь. Когда вода закипит, убавить огонь и варить на медленном — примерно со­рок минут. Готовую долму выложить на ­тарелки (по десять-двенадцать штук на порцию) и сбрызнуть соусом из мацони. Отдельно подать соус в соуснике.",False
359,Круассаны с шоколадом,12,447,7,26.0,49.0,"Как только тесто разморозится, нужно развернуть листы и раскатать тесто в пласт толщиной 0,5 см в виде прямоугольника. Используя нож для пиццы (или обычный нож), разрезать тесто на треугольники (можно на прямоугольники). У основания положить шоколадную крошку (можно кусочки шоколада), затем завернуть круассаны в трубочку. Сверху смазать взбитым яйцом. Духовку разогреть до 220 градусов. Выпекать круассаны 20 минут до золотистого цвета. Дать остыть в течение 5 минут, затем посыпать сахарной пудрой и подавать теплыми.",False
360,«Цезарь» по рецепту Риты Митрофановой,4,684,33,59.0,6.0,"Филе грудок посолить, поперчить и обжарить на оливковом или растительном масле до появления чуть золотистой корочки, затем минут на 7 поставить в духовку, разогретую до 180 градусов. Остудить и нарезать. В миску разбить 1 целое яйцо и туда же добавить желток от второго. Добавить 10 грамм лимонного сока, половину столовой ложки горчицы, плеснуть Ворчестерского соуса и взбить погружным блендером. Белый хлеб избавить от корки, нарезать кубиками и подсушить в духовке при 180 градусах. Затем получившиеся сухарики обжарить на масле с добавлением пары измельченных головок чеснока. Остудить и подсушить. Пармезан натереть на крупной терке. Листья салата романо порвать руками и сложить в салатник. Листья салата залить соусом, засыпать пармезаном. Затем добавить куриные грудки, анчоусы и сухари.",False
361,Кордон-бле,2,3092,73,277.0,77.0,"Куриное филе надрезать вдоль и раскрыть как книгу. Накрыть пищевой пленкой и отбить. На филе выложить тонкие ломтики ветчины и сыра. Закрыть филе так, чтобы сыр не вытек. Плотно завернуть курицу в пищевую пленку и убрать в холодильник на час. Спустя час обвалять рулетики в муке, затем окунуть во взбитое яйцо и покрыть панировочными сухарями. Обжарить курицу с двух сторон в растительном масле так, чтобы рулетики наполовину были погружены в него. Затем выложить на бумажные полотенца, чтобы избавиться от лишнего жира. В разогретой до 180 градусов духовке довести филе до готовности в течение 10–20 минут, в зависимости от размера филе.",False
362,Котлеты «Валленберг»,8,709,33,34.0,71.0,"Телятину три раза прокрутить через мелкую решетку мясорубки. Добавить в фарш сливки и желтки, 10 г соли, перец, взбить блендером или венчиком до однородной, воздушной массы. Разделить фарш на котлеты весом 160 г и обвалять в панировочных сухарях. Обжарить с двух сторон на сливочном масле. Для брусничного соуса соединить мороженые ягоды брусники и сахар в сотейнике. Нагреть, постоянно помешивая, на медленном огне, пока не растает сахар. Остудить. Не стоит варить ягоды — лишь прогреть. Картофель отварить, добавить сливочное масло, соль и размять до нужной консистенции. Замороженный горошек обдать кипятком и тут же откинуть на лед. Подавать котлеты с брусничным соусом, картофельным пюре и бланшированным горошком.",False
363,Баклажаны по-пармски с моцареллой,4,770,15,75.0,15.0,"Разогреть духовку до 220 градусов. Налить в сковороду масло и пропустить чеснок до золотистого цвета. Добавить томаты, соль, перец. Довести до легкого кипения и держать на слабом огне 15 минут. Очистить баклажаны и разрезать вдоль на 5–6 пластинок каждый. Обвалять баклажаны в муке. Обжарить баклажаны на оливковом масле с обеих сторон до коричневатого оттенка (учтите, что баклажаны впитывают масло). Нарезать моцареллу тонкими ломтиками. Взять форму для запекания и слегка смазать ее томатным соусом. Уложить слой баклажанов и сверху слой моцареллы. Полить томатным соусом и уложить еще слой баклажанов с томатами, а сверху слой моцареллы. Запекать в духовке, пока моцарелла не растопится и не приобретет коричневатый оттенок (около 30 минут).",False
364,Яичница по-французски,4,197,11,16.0,2.0,"Сметану вылить на раскаленную сковороду без масла. Подождать, пока выпарится жидкость из сметаны, — после чего аккуратно вылить яйца, посолить, поперчить по вкусу и накрыть сковороду. Сразу же после этого выключить газ и дать яичнице остыть.",False
365,Легкий куриный суп с зеленью,4,276,12,19.0,14.0,"Курицу отварить до готовности, оставить в бульоне. Лук и морковь очистить, нарезать тонкой соломкой, пассеровать на растительном масле. В сотейнике на растительном масле обжарить муку, добавить сметану, влить 1л. куриного бульона, довести до кипения. Положить в бульон пассерованные лук и морковь, варить 3-5 минут, после добавить рубленую зелень, соль, перец, специи. Поварить еще 5-7 минут и убрать с огня. Курицу нарезать на порционные кусочки, разложить по тарелкам. Залить готовым супом.",False
366,Куриное филе в соусе сырном,2,490,39,35.0,5.0,"Куриное филе нарезать кубиками 1×1 см. Разогреть сковороду, влить немного масла и быстро обжарить на нем куриное филе. Приправить солью и перцем. Добавить всю сметану, перемешать и уменьшить огонь. Сыр мелко натереть и добавить к курице. Размешать, дождаться, когда сыр расплавится и сразу же подавать к столу.",False
367,Ризотто с лисичками,4,779,18,39.0,90.0,"Лук и сельдерей мелко нарезать и обжарить на смеси оливкового и сливочного масла. После того как овощи размякнут, добавить лисички (200 г), предварительно их нарезав. Обжаривать до готовности лисичек (готовность определяется на вкус: грибы должны быть полностью протушены, а лук и прочие овощи не должны подгореть; обычно сока, выделяющегося из грибов, хватает, чтобы не допустить подобного развития событий, но если вдруг не хватило — добавьте чуть-чуть масла или бульона), после чего всыпать рис. Обжаривать рис с грибами и овощами пару минут, чтобы рис впитал грибные, овощные соки и масло. Тогда влить треть бульона, посолить, поперчить и оставить на медленном огне, постоянно помешивая и по необходимости подливая бульон небольшими порциями. Тем временем на другой сковороде, прерываясь на помешивание риса, обжарить оставшиеся лисички (не нарезая их) на смеси оливкового и сливочного масла. Когда лисички перестанут давать воду и начнут уверенно зажариваться, бросить мелко ­нарубленный чеснок, посолить, поперчить, подержать на огне пару минут, после чего сдобрить мелко нарубленной петрушкой. Когда рис будет готов, выключить огонь и влить сливки, вмешивая их лопаткой в рисовую массу. Подавать ризотто, гарнировав его жареными лисичками.",False
368,Паста с семгой в сливочно-чесночном соусе,4,452,17,30.0,40.0,"Пасту отварить, добавить оливковое масло. Семгу нарезать небольшими кусочками и обжарить в сливочном масле 5-10 минут. Потихоньку влить сливки и чуть увеличить мощность плиты, довести до кипения, убавить мощность, чтобы чуть подкипала вся масса. Добавить зелень и мелко нарезанный чеснок. Добавить соус в пасту, перемешать и прогреть в кастрюле.",False
369,Суп-пюре из чечевицы,6,203,12,1.0,34.0,"Чечевицу отварить. Лук и помидоры крупно нарезать. Морковь крупно натереть на терке. Имбирь — мелко. Мелко нарубить чеснок. Все овощи поджарить на сковородке. Добавить в кастрюлю к чечевице. Варить на медленном огне 10–15 минут. Все измельчить блендером. Хлеб нарезать мелкими кубиками и поджарить без масла на сковороде на медленном огне 10 минут, постоянно перемешивая.",False
