id_recipe,name_recipe,portions,calories,protein,fat,carbo,text_recipe,vegeterian
162,Безе,12,61,1,,14.0,"Смешиваем 150 г сахара и 2 чайные ложки (но можно и побольше, так запах будет на весь дом) ванильного сахара. Главное — тщательно отделить белки от желтков, иначе белки будут плохо взбиваться и ничего не выйдет. Я беру две чашечки, в одну аккуратно выливаю белки, в другой остаются желтки (их можно прикрыть фольгой, убрать в холодильник и потом что-нибудь тоже из них сделать). Берем какую-нибудь миску, в которой будем взбивать белки (у меня для этого есть специальная пластмассовая посудина, в ней можно взбивать все, что угодно), миксер, и вперед! Важно, конечно, чтобы миксер был мощный. Если все в порядке, то 3–5 минут должно вполне хватить, чтобы получилась крепкая пена, которая не вывалится, даже если вы опрокинете миску вверх дном. Высыпаем сахар из стакана, взбиваем еще минут 5. Пока сахар более менее не станет с пеной одним целым. Дело сделано! Чтобы проверить, насколько все идеально, можно провести венчиками миксера по поверхности пены, и если останутся неподвижные следы, то все ок! На противень кладем лист бумаги для выпекания, чтобы подходил по размеру. Ну и накладываем на него будущие безе в любой форме! Я делаю волшебные штучки с помощью пакетика с разными насадками (что-то вроде кондитерского шприца, только попроще). Можно сделать маленькие безе или большие. Маленькие, кстати, быстрее выпекаются. Ставим в духовку при 120 градусах, на 50–60–80 минут.",False
163,Куриное филе с грибами и сыром,4,599,43,44.0,7.0,"Отбить куриное филе и разложить на противне. Тем временем приготовить смесь из нарезанных грибов, лука, натертого на терке сыра, сметаны, майонеза и зелени петрушки, посолить, поперчить. Выложить готовую смесь на каждый из кусочков филе и запечь в духовке при 180 градусах в течение 30-35 минут до появления румяной корочки.",False
164,Индейка с яблоками и луком,2,465,31,30.0,17.0,"Нарезать индейку на небольшие кусочки и положить ее мариноваться в оливковом масле с соевым соусом. Нарезать яблоко кубиками, а лук — тонкими кольцами. Обжарить лук в подсолнечном масле, помешивая, до золотистого цвета. Добавить к луку индейку вместе с маринадом и жарить на сильном огне несколько минут, постоянно помешивая. Убавить огонь, добавить яблоко, посолить, поперчить, накрыть крышкой и оставить тушиться еще минут на 7–10. В качестве гарнира очень хорошо подойдет гречневая лапша или рис.",False
165,Куриное филе с соусом и гречкой,4,505,54,15.0,39.0,"Отварить гречку. Приготовить соус — смешать в кастрюле молоко, соевый соус и сметану, подержать на огне минуты три, снять и добавить мелко рубленную петрушку. Обжарить на сковороде куриное филе. Когда оно будет готово, добавить лук колечками и обжаривать, пока он не станет золотистого цвета. Добавить на сковороду соус и полстакана воды. Тушить около 15 минут. Подавать филе с гречкой.",False
166,Рис с яйцом по-китайски,4,323,11,14.0,36.0,"Отварить рис около 10–12 минут, почти до готовности, но не до полной мягкости. Слить и промыть под холодной водой, снова слить. В кастрюлю вылить яйца, взбить немного, поставить на маленький огонь, подогревать, помешивая, пока они немного не схватятся. Раскалить масло в большом воке. Добавить раздавленный чеснок, мелко нарезанный лук, отваренный горошек и обжаривать, помешивая, 1–2 минуты. Добавить в вок рис, перемешать. Добавить яйца, светлый соевый соус и щепотку соли, перемешать. Разложить по тарелкам, украсить нарезанным зеленым луком и подавать.",False
167,Котлеты «Фифти-фифти»,12,183,23,3.0,15.0,"Замочить хлеб в молоке и отстать от него на время. Мясо (филе бедра или голени) превратить мясорубкой в фарш. Следом прокрутить хлеб. Репчатый лук нарезать мелкими кубиками и отправить к мясу и хлебу. Зелень избавить от толстых стеблей и мелко нарубить ножом. Добавить в фарш, посолить, поперчить и вымесить все руками — потратить минут десять. А потом еще отбить его как следует, бросая на поверхность, чтобы мясо «задышало». Чем дольше бросать, тем пышнее будут котлеты. Слепить котлеты и обжарить с двух сторон на среднем огне на растительном масле. Затем поставить в духовку минут на десять при 180 градусах.",False
168,Морковный пирог с миндалем,4,781,25,44.0,70.0,"Две крупные морковки очистить и натереть на крупной терке. Миндаль смолоть в крошку в кухонном комбайне. Смешать морковь и миндаль в большой глубокой миске. Яйца разделить на желтки и белки. Желтки взбить с половиной сахара (100 г), добавить муку, разрыхлитель, щепотку корицы, цедру. В конце влить ликер и перемешать. Полученную массу соединить с морковью и миндалем. В отдельной чистой и сухой миске венчиком взбить белки с оставшимся сахаром в плотную пену и аккуратно лопаткой или деревянной ложкой вмешать ее в морковно-ореховое тесто. Тесто перелить в предварительно смазанную небольшим количеством растительного масла глубокую форму. Выпекать чуть меньше часа при температуре 180 градусов. Готовый пирог вынуть из духовки, остудить в течение двадцати — двадцати пяти минут и вынуть из формы. Нарезать на порции и сразу подавать.",False
169,Салат с манго и куриной печенью,3,669,19,55.0,22.0,"Свежее манго очистить от кожи, вырезать косточку, а мякоть нарезать небольшими кубиками. На тарелки выложить по две-три горсти свежих салатных листьев, а сверху на них — кубики манго. Приготовить заправку. Для этого взбить в небольшой миске вилкой дижонскую горчицу, потихоньку вливая оливковое масло. Добавить к этой смеси мед и следом обычную острую горчицу. Хорошо размешать. На небольшой сковороде разогреть растительное масло и быстро обжарить на нем кусочки куриной печени со всех сторон до появления яркой румяной корочки. Посолить и поперчить по вкусу. Готовые кусочки печени аккуратно разложить по тарелкам и щедро полить салат сверху горчично-медовые заправкой — по семь-восемь столовых ложек соуса на порцию. Подавать салат сразу, пока куриная печень не остыла, а зеленые листья не сникли. При желании каждую порцию салата можно дополнительно посыпать свежемолотым черным перцем.",False
170,Мегрельские хачапури,5,1096,46,63.0,89.0,"Муку (530 г) просеять в глубокую миску, добавить дрожжи, соль, сахар, комнатной температуры молоко, растительное масло и 20 грамм размягченного сливочного. Все тщательно перемешать до однородности, если нужно, влить немного воды (около 50 мл). Накрыть миску с тестом, оставить на тридцать-сорок минут. Разделить тесто на пять порций — их нужно ­использовать сразу же или отправить в холодильник. Чтобы сделать начинку, нужно крупно натереть весь сыр, смешать его с яйцом и добавить 20 грамм сливочного масла — если сыр жирный, можно обойтись и без масла: начинка должна быть достаточно рыхлой. Каждую из пяти порций теста слегка присыпать мукой и скалкой раскатать в круг толщиной 5 мм. По периметру сделать проколы зубочисткой, деревянной шпажкой или кончиком ножа, чтобы выпустить воздух. Выложить в центр каждого ­круга 150 грамм сырной на­чинки — смеси имеретинско­го сыра, сулугуни (70 грамм ­пока оставить) и обычного яйца.­ Соединить края теста и защипнуть. Чуть присыпать пироги мукой, снова раскатать их скалкой до диаметра формы для выпечки и толщины 8–10 мм. Проколоть хачапури по пери­метру и уложить в сухие, не сма­занные маслом фор­мы. Распределить по пиро­гам смесь 70 грамм сулугуни и такого же количества раз­мягченного сливочного масла (если сыр жирный, масла мож­но положить меньше), деревенского яйца и сметаны — она ­сделает корочку особенно ­румяной. Поставить хачапури в разогретую до максимальной температуры духовку на десять минут. Перед подачей смазать пироги растопленным сливочным маслом — так они будут выглядеть еще аппетитнее.",False
171,Спагетти аматричана,8,307,10,13.0,38.0,"Разогреть оливковое масло в глубокой сковороде на среднем огне. Нарезать бекон тонкими поперечными полосками, обжарить до золотистого цвета. Добавить черный перец и чили, хорошо перемешать. Мелко нарезать лук и чеснок, соединить с беконом (или панчеттой, как делают в Риме). Обжаривать, постоянно помешивая, пока лук не станет мягким и прозрачным. Добавить в сковороду помидоры, размять их лопаткой. Готовить на слабом огне до тех пор, пока соус не начнет густеть. Оставить на медленном огне еще на 15–20 минут Тем временем вскипятить воду, посолить и бросить спагетти. Снять с огня за 2 минуты до указанного на пачке времени, отбросить на дуршлаг, оставив отдельно стакан воды, в которой варилась паста. Соединить пасту с соусом, основательно перемешать. Добавить 0,5 стакана оставшейся от пасты воды, продолжить готовить те самые 2 минуты. Если консистенция соуса покажется суховатой, добавить оставшуюся воду. Подавать, посыпав пасту пармезаном или другим твердым сыром.",False
172,Коулсло,8,253,4,21.0,13.0,"Срежьте кочерыжку и старые листья с капусты. Тонко нашинкуйте и переложите в большую миску. На терке натрите морковь и редьку и смешайте с капустой. Добавьте мелко нарезанный перец, зеленый лук и петрушку. Перед подачей заправьте майонезом, посыпьте солью и хорошо перемешайте.",False
173,Банановые оладьи на молоке,4,429,7,12.0,76.0,"Смешайте в миксере бананы, яйца, молоко и сахар вплоть до образования однородной массы. Вмешайте туда же муку и быстро перемешайте, но не до однородного состояния. Ложкой выкладывайте полученную массу на горячую сковороду с маслом. Обжаривайте с обеих сторон, пока оладьи не станут коричневыми.",False
174,Бефстроганов,6,690,36,59.0,3.0,"Говяжью вырезку очистить от пленок, нарезать тонкими ломтиками — по 3–5 мм. Разогреть сковороду и обжарить на ней ломтики мяса, предва­рительно их посолив, на части растительного масла. Готовить только до появления коричневой корочки, после чего убрать в теплое место. Мясо нужно ­жарить не все сразу, а частями, чтобы кусочки нормально обжаривались, а не тушились вместе. В сотейник налить белое вино и выпарить его на три четверти на быстром огне. Добавить бульон — его нужно уварить примерно наполовину. На сковороде, плеснув туда растительного масла, обжарить до коричневой корочки нарезанные ломтиками белые грибы и снять с огня. В сотейник с бульоном добавить сливки и сметану и томить на среднем огне, не давая соусу убежать через край сотейника. Когда соус загустеет, приправить его солью и перцем. Выложить в сковороду с гри­бами обжаренное мясо, залить соусом, довести его до слабого кипения и потомить мясо еще три минуты. Заправить бефстроганов дижонской горчицей, перемешать и подавать со спагетти или лапшой.",False
175,Шведские булочки с корицей,12,428,8,13.0,72.0,"Подогреть молоко до 37 градусов, молоко не должно быть горячим, а только теплым. Размешать дрожжи в молоке. Добавить растопленное сливочное масло (100 гр.), соль и 110 грамм сахара. Замесить тесто, постепенно добавляя муку. Тесто должно быть эластичным и отставать от рук, чем дольше месить, тем лучше. Оставить тесто под полотенцем минут на тридцать-пятьдесят. Тесто обмять и раскатать толщиной 3 мм. Смазать растопленным маслом (50 гр.), щедро посыпать корицей и сахаром и сложить пополам. Разрезать тесто на длинные полоски шириной около 2,5 см. Взявшись за один конец полоски, скрутить тесто в булочку, напоминающую улитку или розочку. Смазать булочки слегка взбитым яичным желтком. Выпекать в разогретой до 220 градусов духовке около пятнадцати минут.",False
176,Классический грибной жюльен,1,745,22,59.0,36.0,"Измельчить лук и грибы, обжарить с солью и перцем на сливочном масле. Добавить муку и перемешать. Разложить грибную смесь по формочкам, залить сливками, посыпать тертым сыром и запекать в духовке при 180 градусах 20–25 минут.",False
