id_recipe,name_recipe,portions,calories,protein,fat,carbo,text_recipe,vegeterian
563,Японский омлет,2,150,12,10.0,2.0,"Яйца смешайте с соевым соусом и рисовым уксусом. Если соус соленый, добавьте чуть-чуть сахара (треть чайной ложки), а если сладкий, то можно немного посолить. Слегка взбейте смесь вилкой, чтобы получилась однородная масса. Смажьте сковороду, нагрейте ее на небольшом огне и налейте немного яичной смеси, чтобы выпечь тонкий блинчик. Когда яйца схватятся, загните два противоположных края к центру. Затем сложите блинчик пополам вдоль. Сдвиньте получившийся сверток к самому краю сковороды, а на свободную часть налейте еще порцию яичной смеси. Новый блинчик должен одним краем приклеиться к первому. Когда второй блинчик немного схватится, накрутите его на первый. Повторяйте этот и предыдущий этапы, пока не кончится смесь или рулетик не получится достаточно толстым. Осталось нарезать омлет поперек и подать.",False
564,Крем-суп из цветной капусты,6,314,11,24.0,16.0,"Цветную капусту разобрать на соцветия, самые маленькие из них сварить целиком в подсоленной воде, а крупные порезать на более мелкие части. Как только маленькие соцветия сварятся, надо их тут же остудить, чтобы сохранить состояние аль-денте. Параллельно надо растопить в сотейнике или кастрюле сливочное масло и обжарить на нем мелкорубленый порей (только белую часть), не забывая все время перемешивать, чтобы не дать луку потемнеть. Влить в кастрюлю молоко, добавить нарезанные соцветия капусты и оставить вариться на небольшом огне в течение пяти минут. Молоко при этом не должно бурно кипеть, а лишь спокойно побулькивать. Через пять минут влить в кастрюлю горячий куриный бульон и варить, пока капуста не станет совсем мягкой. Снять с огня. Посолить, поперчить по вкусу, добавить мелко нарезанную петрушку, сливки и прокрутить суп в блендере.Подавать в глубокой тарелке, положив в нее маленькие похрустывающие соцветия цветной капусты и немного красной икры.",False
565,Блины тонкие обыкновенные,4,340,12,16.0,37.0,"Разбиваем яйца и хорошенько перемешиваем. Добавляем муку и тщательно перемешиваем. Получается очень густая консистенция, и, что самое главное, без комочков. По чуть-чуть вливаем молоко и перемешиваем, чем жиже тесто -—тем больше за раз можно добавлять молока. Такой способ поэтапного смешивания ингредиентов позволяет не переживать о возможных комочках, что в случае, когда нет под рукой миксера, становится очень актуально. Теперь добавляем соль, сахар. Когда сковородка достаточно нагреется (ни в коем случае она не должна быть слишком горячей, в моем случае это температура средняя между максимально возможной и средней для плиты) добавляем в тесто масло, перемешиваем и начинаем жарить блинчики. С одной стороны сковородки выливаем немного теста и быстрыми наклонными движениями равномерно распределяем тесто по поверхности, таким образом получается круглый и тонкий блинчик. Примерно секунд 15–20 ждем, пока схватится нижняя сторона, а края подрумянятся, и переворачиваем блинчик, другая сторона готовится еще быстрее.",False
566,Чесночный суп «Айго-булидо»,4,553,22,13.0,84.0,Очистить чеснок и раздавить его в ступке пестиком. Вскипятить полтора литра воды в кастрюльке и всыпать в нее давленый чеснок. Кипятить пять минут на среднем огне. В сковороде на оливковом масле слегка обжарить мелко нарубленные помидоры и листья шалфея и переложить их в кастрюльку с кипятком и чесноком. Варить еще минуту. Отделить желтки от белков. Выключить огонь и загустить суп яичными желтками. В тарелку положить горсть наломанных руками маленьких ­кусочков хлеба и залить их супом.,False
567,Грибной суп-пюре,3,482,13,42.0,16.0,"Порубить лук на мелкие кусочки. Подготовить грибы. Пропустить грибы через мясорубку. Затем добавить в них лук. Смесь обжарить на сковороде с добавлением сливочного масла до испарения воды. Посолить и поперчить по вкусу. Переложить жареные грибы в кастрюлю, залить сливками и довести до кипения. Суп готов. Блюдо можно подавать к столу как в горячем, так и в холодном виде. В последнем случае оно может заменить закуску вроде жюльена.",False
568,Печень по-строгановски,5,240,22,12.0,11.0,"Лук мелко покрошить. Печень очистить от пленочек, нарезать брусочками. Обжарить лук на растительном масле до золотистого цвета. Добавить печень, посолить, поперчить, обжарить со всех сторон. Добавить сметану, тушить 15–20 минут.",False
569,Кекс «Столичный»,4,717,9,31.0,103.0,"Размягчить сливочное масло в миске, добавить 2 яйца, сахар, сметану и погашенную соду. Перемешать, положить изюм и, помешивая, медленно всыпать муку. Выложить тесто (возможно, жидковатое) в нагретую форму. Выпекать примерно 30 минут при температуре 180–220 градусов до коричневого цвета.",False
570,Груша в красном вине,6,594,7,21.0,85.0,"Груши очистить от кожицы, сохранив плодоножку. Никакого особого смысла этот жест не имеет, кроме того, что считается, будто бы с плодоножкой груша выглядит симпатичней. В неглубокую кастрюлю влить шипучее полусладкое вино ламбруско, распотрошить туда же стручок ванили, разрезав его сначала пополам, а потом ножом соскоблив в кастрюлю семечки. Пустопорожний стручок тоже надо бросить в кастрюлю. В ту же кастрюлю всыпать сахар, бросить корицу и бадьян и, до­ждавшись, пока вино закипит, бросить туда груши. Вино на время успокоится, а потом примется кипеть с новой силой, и тогда нужно убавить огонь до минимума, чтобы содержимое кастрюли чуть побулькивало. В таком состоянии надо оставить кастрюлю на час пятьдесят. После чего извлечь груши шумовкой и отложить охлаждаться. А оставшееся в кастрюле вино уварить, чтобы оно слегка загустело. Это будет соус. Подавать груши, срезав у них дно, чтобы на тарелке груши могли стоять торч­ком — считается, что так груши выглядят симпатичней, — полив соусом и сопроводив мороженым.",False
571,Яичница по-французски в хлебе,2,224,10,15.0,11.0,"В середине куска хлеба сделать отверстие, удалив мякиш. На сковороде растопить масло, обжарить хлеб с двух сторон. Яйца аккуратно разбить и вылить в центр хлебной формы. Посолить. Жарить до готовности. Подавать яичницу с порезанным помидором и зеленью.",False
572,Оладьи из брокколи с сыром,4,130,8,4.0,17.0,"Отварите капусту в подсоленной воде, откиньте на дуршлаг, измельчите. Отдельно взбейте яйцо, добавьте муку, соль, перец, сыр. Смешайте с брокколи. Разогрейте масло на сковороде, формируйте форму оладьев и жарьте с каждой стороны 3 минуты. Подавайте с йогуртовым соусом (смешайте 2 столовые ложки йогурта натурального, мелко порубите мяту, раздавите чеснок чеснокодавилкой и поперчите).",False
573,Бефстроганов из говяжьей вырезки,2,682,37,57.0,6.0,"Говядину нарезаем небольшими полосками. Лук мелко рубим. Выкладываем мясо и лук в сковородку, соль и перец добавляем по вкусу, и жарим до полуготовности. Смешиваем сливки со сметаной в однородную массу (если нет 38% сливок, берите самые жирные, которые найдете). Заливаем мясо сливочным соусом и тушим примерно минут 7.",False
574,Уха из сибаса,4,354,51,8.0,23.0,"Очистить овощи. Корень сельдерея разрезать на восемь частей, цукини и белую часть одного стебля лука-порея — на четыре, морковь и стебель сельдерея — пополам. Сибаса очистить от потрохов и чешуи. За жабрами сделать надрез и аккуратно снять филе с костей острым и достаточно широким ножом, двигаясь от головы к хвосту и прижимая рыбу второй рукой. Проделать то же самое с другим боком сибаса. Рыбьи скелеты с головами хорошенько промыть. Филе избавить от плавников и очистить от оставшихся костей. Сначала нужно сделать продольный надрез в центре — уголком, чтобы вынуть центральную кость. А потом срезать нижние кости вместе с тонким слоем мяса. Должны получиться четыре аккуратных куска мяса на коже. В большую кастрюлю налить три с половиной — четыре литра воды. Положить туда разрезанные овощи (одну половинку моркови оставить), неразрезанные луковицы, рыбьи скелеты с головами, а также петрушку и укроп (немного зелени нужно отложить). Вода в итоге должна едва-едва покрывать содержимое, а кое-какие части будут даже из нее выступать. Довести воду до кипения на сильном огне, потом убавить огонь и варить уху час. Помешивать не нужно, лучше время от времени поливать высту­пающие овощи бульоном с помощью ­половника. Готовый бульон снять с огня и процедить через ­сито шинуа в кастрюльку поменьше. Кастрюлю с процеженным ­бульоном поставить на средний огонь и аккуратно выложить в нее филе сибаса. Подержать на огне три минуты. Мелко нарезать оставшуюся петрушку и белую часть лука-порея, половину моркови порубить тонкой соломкой. Переправить все это в бульон. Посолить по вкусу — в принципе, одной чайной ложки будет вполне достаточно. Оставить на огне еще на минуту-другую. Разлить бульон по тарелкам. Положить в каждую по куску сибаса. Сверху посыпать мелко нарезанным укропом — и подавать на стол.",False
575,Крамбл из сливы,6,562,9,24.0,82.0,"Холодное масло смешать с мукой и сахаром в комковатое песочное тесто, добавить овсяные хлопья и тоже перемешать. Выложить тесто на пекарскую бумагу и запечь в духовке, разогретой до 170 градусов, в течение десяти минут. Сливы разрезать пополам, извлечь косточки и выложить в форму, посыпать корицей, сверху накрошить тесто из муки, сахара, масла и овсяных хлопьев. Поставить в духовку, разогретую до 170 градусов, на пятнадцать-двадцать минут.",False
576,Яйца по-шотландски,6,852,38,52.0,60.0,"Шесть яиц залить водой в сотейнике, довести до кипения, после чего снять с огня и оставить в горячей воде на 6 минут. Затем переложить в миску с ледяной водой, оставить еще на пять минут, после чего очистить от скорлупы. Извлечь фарш из оболочки. Смешать его с горчицей, крахмалом, мускатным ­орехом и измельченными ­тимьяном и шалфеем. Разделить на 6 равных частей, размять каждую в лепешку и обернуть вокруг каждого яйца. Выложить на блюдо и отправить в холодильник на полчаса. В большой сковороде разогреть масло до 180 градусов. Оставшееся яйцо взбить с молоком в небольшой миске, в отдельную емкость насыпать муку и сухари, перемешать. По очереди окунуть котлетки в яичную смесь, а затем обвалять в сухарях, после чего поджарить в масле в течение 7 минут до золотистой корочки. Подавать с вустерширским соусом.",False
577,Соленые лимоны,12,127,1,13.0,3.0,"Лимоны (лучше брать не очень крупные, чтобы проще было засовывать их в банку) вымыть, сделать на них надрезы — так, как будто режем их на шесть частей, но не дорезаем до конца. Из двух надрезанных лимонов сначала руками выжать сок в литровую банку, а затем уложить в нее все лимоны (выжатые в том числе), добавить соль, перец, лавровый лист и залить все оливковым маслом. Выдерживать лимоны нужно не меньше месяца, а затем их можно добавлять в любые несладкие блюда, например, в тушеное мясо, а само масло добавлять в салаты.",False
578,Брауни с творогом и вишней,4,805,19,41.0,90.0,"Шоколад поломать на кусочки. Растопить вместе с маслом, на водяной бане. 2 яйца и 50 грамм сахара, взбить миксером, добавить щепотку соли и ванильный сахар. Для творожного крема, творог смешать с сахаром и оставшимися яйцами (2 штуки). Растереть миксером, до кремообразного состояния. Если творог зернистый, протереть его предварительно через сито. Во взбитые с сахаром яйца, добавить остуженный, растопленный шоколад. Добавляем разрыхлитель и муку. Перемешиваем миксером, на самой низкой скорости. В форму (у меня разъемная), с высокими бортиками, смазанную сливочным маслом, вылить 1/3 теста. Распределить по форме. Выложить половину творожной массы. В рецепте было сказано, что она растечется, но у меня этого не произошло — я ее лопаткой разровняла. На массу выкладываем вишню — половину от всего количества. Далее повторяем слои: тесто, масса, вишня, тесто. Тесто стараться распределить равномерно, где-то это может не получаться — это не страшно. По верхнему слою, можно сделать разводы ножом. Выпекать 40–50 минут, в разогретой до 180 градусов духовке. Готовность проверять лучинкой — она должна быть сухой. Остудить в форме.",False
579,Кубинский салат с курицей и авокадо,2,807,29,67.0,25.0,"Курицу нарезать тонкими ломтиками и замариновать в соке лайма с солью и перцем в течение 5–10 минут. Обжарить на растительном масле до золотистого цвета. Апельсин очистить ножом, срезая все белые части, затем вырезать дольки, избегая пленок. Лук нарезать толстой соломкой, авокадо разрезать пополам, извлечь косточку, при помощи ложки избавить половинки авокадо от кожи и нарезать дольками. Смешать сок лайма с измельченной мятой, 60 мл масла, сахаром, солью и перцем при помощи венчика. Смешать романо, курицу, авокадо и филе апельсина с лаймовой заправкой и тут же подавать.",False
580,Сырный суп с креветками и зеленью,4,441,34,13.0,51.0,"Нарезать чеснок, лук и морковь и обжарить на сковороде до нужной мягкости. В двух литрах кипящей воды расплавить натертый сыр, добавляя его столовой ложкой и постоянно помешивая. Посолить, добавить специи по вкусу. В сырный бульон скинуть нарезанный ломтиками картофель. Когда картофель сварится, снять с огня и добавить в суп обжаренную смесь из моркови, лука и чеснока и мелко нарезанную зелень. Свежие креветки заранее очистить и в отдельной миске залить небольшим количеством готового горячего супа. Порозовевшие креветки добавить в тарелку с супом перед подачей на стол.",False
581,Ароматная свинина в духовке,5,404,39,26.0,2.0,"В ступке растереть розмарин перцем и солью. Добавить цедру, чеснок, кориандр и оливковое масло (если нет сушеного чеснока, можно выдавить пару зубчиков). Хорошо перемешать. Свинину промыть, просушить. Если есть слой жира — ножом сделать надрезы в виде сеточки. Натереть свинину пряной смесью. Мясо завернуть в пищевую пленку и положить на 2 часа в холодильник. За 2 часа до запекания достать и держать при комнатной температуре. Разогреть духовку до 200 градусов. Размотать свинину и переложить в рукав для запекания, тщательно закрыть. Сделать несколько проколов. Запекать в разогретой духовке 15 минут. Уменьшить температуру до 170 градусов и печь до готовности, приблизительно час. На гарнир отдельно можно смешать овощи (брокколи по соцветиям, кабачки, перец сладкий, грибы и помидоры черри) с оливковым маслом и специями и высыпать на противень, когда мясу останется печься 35–40 минут.",False
582,Табуле,6,243,5,17.0,18.0,"Булгур отварить в подсоленной воде и дать ему остыть. Помидоры избавить от семечек (кожицу можно оставить), иначе в процессе настаивания с лимонным соком помидорная мякоть превратится в кашу. Нарезать крупным кубиком. Петрушку, помидоры, лук и мяту мелко нарубить. Смешать зелень и помидоры с булгуром, соком лимонов и оливковым маслом — и дать настояться в холодильнике примерно полчаса.",False
